{"version":1,"run_key":"qrk_eyJ2ZXJzaW9uIjoxLCJzaWduZXIiOiJ1b0VTLWt1ajF2azBzcTBxb0dsbUFnIiwicnVuX2lkIjoiMDE5MmYwYzEtN2Q0ZS03YTJiLThjM2QtNGU1ZjZhN2I4YzlkIiwid29ya3NwYWNlIjoid3NfZjF4dDByZTAwMDAwMDAwMCIsIm5vZGVfaWQiOiJucF9mMXh0MHJlMDAwMDAwMDAwIiwiZ2F0ZXdheSI6Im5nX2YxeHQwcmUwMDAwMDAwMDAiLCJnYXRld2F5X3VybCI6Imh0dHBzOi8vZ2F0ZXdheS5leGFtcGxlOjg0NDMiLCJnYXRld2F5X3B1YmxpY19rZXkiOlt7ImFsZyI6ImVkMjU1MTkiLCJwdWJsaWNfa2V5IjoiaUMwT283S0dUbnBZZno1cGpPcEVXWm1ERXVaVjRGLWw2TFVSbll1cXlNMCJ9XSwiaW5zdGFuY2VfaWQiOiJpX2dZS0RoSVdHaDRpSmlvdU1qWTZQa0EiLCJpc3N1ZWQiOiIyMDI2LTEwLTExVDEyOjAwOjAwWiIsImF0dGFjaF9ieSI6IjIwMjYtMTAtMTFUMTI6MTA6MDBaIn0.yUWE4vdQuSfML2OcqdMfci8yz-SsJLox2axjdUcV2kApoefXtYRtCtjALoeoBvj4WSeIervaVsET-0PuSHA2Cg","interval_seconds":30,"events":["*"],"forager_version":"v0.7.0-dev","contract_version":1,"time":"2026-10-11T12:00:05Z"}